LAUMT481314000000003,"Beaumont, TX","Beaumont-Port Arthur, TX Metropolitan Statistical Area",9.7,5.4,5.4,5.8,5.9,5.7,5.3,16.8,0.7,0.3,-0.3,-0.1,-0.2,171748.0,-0.1
LAUMT481518000000003,"Brownsville, TX","Brownsville-Harlingen, TX Metropolitan Statistical Area",8.4,5.3,5.0,5.5,5.8,5.4,4.8,15.6,0.8,0.3,-0.3,-0.2,-0.7,184929.0,12.4
LAUMT481778000000003,"College Station, TX","College Station-Bryan, TX Metropolitan Statistical Area",4.1,2.8,2.7,3.3,3.5,3.1,2.6,8.5,0.6,0.2,0.0,-0.1,-0.2,156199.0,15.3
LAUMT481858000000003,"Corpus Christi, TX","Corpus Christi, TX Metropolitan Statistical Area",7.5,4.6,3.9,4.4,4.6,4.4,4.0,14.4,0.6,0.4,-0.1,0.1,-0.3,210521.0,2.9
LAUMT481910000000003,"Dallas, TX","Dallas-Fort Worth-Arlington, TX Metropolitan Statistical Area",5.3,3.2,3.3,3.9,4.2,3.9,3.4,12.1,0.6,0.3,0.1,0.1,0.1,4435423.0,13.7
LAUMT482134000000003,"El Paso, TX","El Paso, TX Metropolitan Statistical Area",6.5,3.9,3.9,4.5,4.8,4.5,3.9,13.8,0.6,0.3,0.0,0.0,0.1,385578.0,7.1
LAUMT482642000000003,"Houston, TX","Houston-The Woodlands-Sugar Land, TX Metropolitan Statistical Area",6.7,3.8,3.8,4.4,4.6,4.3,3.8,13.5,0.6,0.2,0.0,0.0,-0.0,3686520.0,9.0
LAUMT482866000000003,"Killeen, TX","Killeen-Temple, TX Metropolitan Statistical Area",5.6,3.9,3.9,4.5,4.9,4.5,3.9,10.5,0.7,0.4,-0.2,0.0,0.0,188109.0,7.9
LAUMT482970000000003,"Laredo, TX","Laredo, TX Metropolitan Statistical Area",6.6,4.0,3.7,4.2,4.8,4.3,3.7,12.6,0.9,0.5,0.1,0.0,-0.0,122763.0,4.9
LAUMT483098000000003,"Longview, TX","Longview, TX Metropolitan Statistical Area",6.5,3.8,3.6,4.6,4.9,4.4,3.8,11.4,0.7,0.2,0.3,0.2,0.1,100069.0,2.0
LAUMT483118000000003,"Lubbock, TX","Lubbock, TX Metropolitan Statistical Area",4.6,3.0,2.9,3.4,3.7,3.6,2.8,9.3,0.7,0.4,0.0,-0.1,-0.1,173701.0,7.4
LAUMT483258000000003,"McAllen, TX","McAllen-Edinburg-Mission, TX Metropolitan Statistical Area",9.7,6.0,5.4,6.4,6.2,6.0,5.4,16.8,0.8,0.0,-0.2,0.0,-0.9,383249.0,10.1
LAUMT483326000000003,"Midland, TX","Midland, TX Metropolitan Statistical Area",6.1,2.8,2.2,2.6,2.9,2.6,2.2,9.8,0.5,0.3,0.1,0.0,0.1,116498.0,8.1
LAUMT483622000000003,"Odessa, TX","Odessa, TX Metropolitan Statistical Area",9.1,3.7,3.0,3.5,3.8,3.4,3.0,13.0,0.5,0.3,0.0,0.0,0.3,87259.0,-0.2
LAUMT484166000000003,"San Angelo, TX","San Angelo, TX Metropolitan Statistical Area",4.9,3.1,3.1,3.5,3.9,3.5,3.0,9.5,0.6,0.3,0.1,-0.1,-0.0,58253.0,5.6
LAUMT484170000000003,"San Antonio, TX","San Antonio-New Braunfels, TX Metropolitan Statistical Area",5.3,3.3,3.3,3.7,4.1,3.8,3.3,12.6,0.6,0.4,0.0,0.0,0.2,1305850.0,10.2
LAUMT484330000000003,"Sherman, TX","Sherman-Denison, TX Metropolitan Statistical Area",4.5,3.2,3.3,3.7,4.1,3.7,3.4,9.8,0.6,0.4,-0.1,0.1,0.3,70861.0,11.7
LAUMT484550000000003,"Texarkana, TX","Texarkana, TX-AR Metropolitan Statistical Area",5.6,4.0,3.5,4.3,4.4,4.1,3.7,13.0,0.7,0.3,0.1,0.2,-0.6,62700.0,-2.7
LAUMT484634000000003,"Tyler, TX","Tyler, TX Metropolitan Statistical Area",5.3,3.3,3.2,3.9,4.2,3.8,3.3,11.3,0.6,0.3,0.2,0.1,-0.0,116199.0,8.7
LAUMT484702000000003,"Victoria, TX","Victoria, TX Metropolitan Statistical Area",6.6,3.8,3.7,4.2,4.5,4.1,3.6,13.3,0.7,0.3,0.0,-0.1,0.1,44695.0,-2.4
LAUMT484738000000003,"Waco, TX","Waco, TX Metropolitan Statistical Area",4.8,3.2,3.4,3.7,4.1,3.7,3.1,9.8,0.7,0.4,-0.2,-0.3,-0.2,139515.0,12.2
LAUMT484866000000003,"Wichita Falls, TX","Wichita Falls, TX Metropolitan Statistical Area",5.2,3.5,3.4,4.0,4.4,4.1,3.3,10.2,0.7,0.4,0.0,-0.1,0.1,65348.0,1.4
LAUMT493086000000003,"Logan, UT","Logan, UT-ID Metropolitan Statistical Area",2.1,1.9,2.1,2.7,2.7,2.3,2.3,5.8,0.4,0.1,-0.1,0.2,0.2,79477.0,9.4
LAUMT493626000000003,"Ogden, UT","Ogden-Clearfield, UT Metropolitan Statistical Area",2.9,2.2,2.3,2.9,3.2,2.7,2.7,9.4,0.5,0.3,0.1,0.4,0.1,367210.0,10.8
LAUMT493934000000003,"Provo, UT","Provo-Orem, UT Metropolitan Statistical Area",2.5,2.0,2.3,2.9,3.2,2.7,2.7,7.4,0.4,0.3,0.2,0.4,0.4,361994.0,14.9
LAUMT494110000000003,"St. George, UT","St. George, UT Metropolitan Statistical Area",3.1,2.4,2.4,3.2,3.3,2.7,2.8,11.7,0.4,0.1,0.0,0.4,-0.1,92484.0,21.5
LAUMT494162000000003,"Salt Lake City, UT","Salt Lake City, UT Metropolitan Statistical Area",3.1,2.3,2.5,3.0,3.3,2.8,2.8,10.6,0.5,0.3,0.1,0.3,0.3,729047.0,9.8
LAUMT507240000000003,"Burlington, VT","Burlington-South Burlington, VT Metropolitan NECTA",3.8,1.9,1.3,2.0,1.9,1.6,1.7,11.6,0.2,-0.1,0.0,0.4,0.0,133952.0,3.9
LAUMT511398000000003,"Blacksburg, VA","Blacksburg-Christiansburg-Radford, VA Metropolitan Statistical Area",3.2,2.2,2.2,2.5,2.8,2.4,2.2,11.6,-0.2,-0.2,-0.3,0.0,-0.8,101557.0,9.0
LAUMT511682000000003,"Charlottesville, VA","Charlottesville, VA Metropolitan Statistical Area",3.4,2.1,2.1,2.5,2.6,2.1,2.0,10.2,-0.2,-0.3,-0.5,-0.1,-0.5,128655.0,5.1
LAUMT512550000000003,"Harrisonburg, VA","Harrisonburg, VA Metropolitan Statistical Area",3.2,2.2,2.2,2.6,2.9,2.5,2.2,10.7,-0.2,-0.2,-0.3,0.0,-0.5,70942.0,5.3
LAUMT513134000000003,"Lynchburg, VA","Lynchburg, VA Metropolitan Statistical Area",4.0,2.5,2.8,3.3,3.4,2.9,2.7,10.4,-0.2,-0.3,-0.5,-0.1,-0.5,124038.0,-0.5
LAUMT514006000000003,"Richmond, VA","Richmond, VA Metropolitan Statistical Area",4.4,2.4,2.5,2.9,3.1,2.6,2.5,11.5,-0.2,-0.2,-0.4,0.0,-0.4,722887.0,5.0
LAUMT514022000000003,"Roanoke, VA","Roanoke, VA Metropolitan Statistical Area",3.8,2.3,2.4,2.7,2.9,2.4,2.3,10.8,-0.1,-0.2,-0.4,-0.1,-0.5,163864.0,2.8
LAUMT514442000000003,"Staunton, VA","Staunton-Waynesboro, VA Metropolitan Statistical Area",3.4,2.2,2.2,2.5,2.7,2.1,2.1,9.9,-0.1,-0.2,-0.4,-0.1,-0.4,63378.0,4.2
LAUMT514726000000003,"Virginia Beach, VA","Virginia Beach-Norfolk-Newport News, VA-NC Metropolitan Statistical Area",4.7,2.6,2.6,2.9,3.1,2.6,2.5,12.4,-0.2,-0.2,-0.5,-0.1,-0.6,882708.0,2.3
LAUMT514902000000003,"Winchester, VA","Winchester, VA-WV Metropolitan Statistical Area",3.2,2.1,2.2,2.6,2.7,2.3,2.1,10.0,0.0,-0.1,-0.3,-0.1,-0.6,80440.0,9.2
LAUMT531338000000003,"Bellingham, WA","Bellingham, WA Metropolitan Statistical Area",6.2,4.3,3.7,5.6,6.3,5.4,4.5,18.2,1.1,0.3,1.1,0.8,-0.5,115026.0,-1.9
LAUMT531474000000003,"Bremerton, WA","Bremerton-Silverdale, WA Metropolitan Statistical Area",5.3,4.1,3.5,5.3,5.9,5.2,4.3,14.8,1.0,0.3,1.0,0.8,-0.3,129163.0,-0.4
LAUMT532842000000003,"Kennewick, WA","Kennewick-Richland, WA Metropolitan Statistical Area",6.0,4.8,4.2,6.4,7.0,6.0,4.9,13.9,1.3,0.2,0.7,0.7,-0.7,149356.0,3.7
LAUMT533102000000003,"Longview, WA","Longview, WA Metropolitan Statistical Area",6.6,5.3,4.5,6.4,7.1,6.2,5.2,16.2,1.2,0.3,0.9,0.7,-0.8,48139.0,-1.5
LAUMT533458000000003,"Mount Vernon, WA","Mount Vernon-Anacortes, WA Metropolitan Statistical Area",6.5,4.8,4.0,6.2,6.7,5.8,4.9,19.4,1.2,0.2,1.1,0.9,-0.5,62014.0,-2.6
LAUMT533650000000003,"Olympia, WA","Olympia-Tumwater, WA Metropolitan Statistical Area",5.3,4.2,3.6,5.4,5.9,5.2,4.4,16.2,1.0,0.3,0.9,0.8,-0.5,151296.0,4.6
LAUMT534266000000003,"Seattle, WA","Seattle-Tacoma-Bellevue, WA Metropolitan Statistical Area",4.8,2.9,3.0,4.7,4.7,4.4,4.1,16.9,0.7,0.2,0.9,1.1,0.9,2252032.0,3.2
LAUMT534406000000003,"Spokane, WA","Spokane-Spokane Valley, WA Metropolitan Statistical Area",5.6,4.3,3.8,6.0,6.7,5.7,4.4,16.3,1.5,0.4,0.9,0.6,-1.0,289937.0,2.3
LAUMT534746000000003,"Walla Walla, WA","Walla Walla, WA Metropolitan Statistical Area",4.8,4.2,3.4,5.7,6.4,5.2,4.2,12.4,1.3,0.2,1.0,0.8,-0.8,31796.0,-0.4
LAUMT534830000000003,"Wenatchee, WA","Wenatchee, WA Metropolitan Statistical Area",5.7,4.6,3.9,6.4,6.9,5.7,4.5,16.0,1.6,0.2,0.8,0.6,-0.7,66219.0,3.0
LAUMT534942000000003,"Yakima, WA","Yakima, WA Metropolitan Statistical Area",7.3,5.9,5.3,8.4,8.8,7.5,6.3,14.7,2.0,0.1,1.0,1.0,-0.8,126942.0,-1.6
LAUMT541322000000003,"Beckley, WV","Beckley, WV Metropolitan Statistical Area",6.8,3.9,3.5,4.7,4.9,5.0,3.8,18.5,1.0,0.4,0.8,0.3,-1.3,46083.0,0.7
LAUMT541662000000003,"Charleston, WV","Charleston, WV Metropolitan Statistical Area",6.6,3.8,3.4,4.5,4.7,4.7,3.7,17.4,1.0,0.4,1.0,0.3,-1.1,92630.0,1.4
LAUMT542658000000003,"Huntington, WV","Huntington-Ashland, WV-KY-OH Metropolitan Statistical Area",5.6,3.9,3.8,5.0,5.3,5.2,4.3,16.5,1.2,0.6,0.9,0.5,-0.7,145937.0,0.5
LAUMT543406000000003,"Morgantown, WV","Morgantown, WV Metropolitan Statistical Area",4.6,3.5,2.9,3.8,3.8,4.0,3.1,12.8,0.7,0.3,0.8,0.2,-0.8,71206.0,2.6
LAUMT543762000000003,"Parkersburg, WV","Parkersburg-Vienna, WV Metropolitan Statistical Area",6.3,4.1,3.9,5.4,5.8,5.3,4.1,17.2,1.5,0.6,0.8,0.2,-1.2,39062.0,2.2
LAUMT544854000000003,"Wheeling, WV","Wheeling, WV-OH Metropolitan Statistical Area",6.7,4.6,4.0,5.3,5.6,5.4,4.6,16.7,1.6,0.8,0.5,0.6,-0.9,61770.0,-4.8
LAUMT551154000000003,"Appleton, WI","Appleton, WI Metropolitan Statistical Area",3.4,2.4,2.1,2.2,2.7,2.8,2.5,13.1,0.2,0.4,0.4,0.4,-0.3,133143.0,1.9
LAUMT552074000000003,"Eau Claire, WI","Eau Claire, WI Metropolitan Statistical Area",4.0,2.9,2.8,3.1,3.4,3.5,2.9,12.6,0.7,0.4,0.1,0.1,-0.3,95105.0,2.8
LAUMT552254000000003,"Fond du Lac, WI","Fond du Lac, WI Metropolitan Statistical Area",3.5,2.3,2.2,2.3,2.7,2.9,2.5,16.3,0.3,0.4,0.3,0.3,-0.3,56291.0,-1.9
LAUMT552458000000003,"Green Bay, WI","Green Bay, WI Metropolitan Statistical Area",3.8,2.6,2.3,2.5,3.0,3.1,2.7,13.3,0.3,0.4,0.3,0.4,-0.3,173168.0,-0.2
LAUMT552750000000003,"Janesville, WI","Janesville-Beloit, WI Metropolitan Statistical Area",5.2,3.4,3.0,3.0,3.6,3.7,3.3,16.3,0.4,0.5,0.1,0.3,-0.3,88167.0,3.1
LAUMT552910000000003,"La Crosse, WI","La Crosse-Onalaska, WI-MN Metropolitan Statistical Area",3.3,2.3,2.1,2.4,2.8,2.8,2.4,11.8,0.4,0.4,0.2,0.3,-0.5,78776.0,1.9
LAUMT553154000000003,"Madison, WI","Madison, WI Metropolitan Statistical Area",3.3,2.0,1.9,2.0,2.3,2.5,2.2,11.0,0.1,0.3,0.4,0.3,-0.2,411432.0,5.3
LAUMT553334000000003,"Milwaukee, WI","Milwaukee-Waukesha-West Allis, WI Metropolitan Statistical Area",5.2,3.1,2.8,2.8,3.4,3.6,3.2,14.2,0.2,0.4,0.5,0.4,-0.2,809600.0,-1.3
LAUMT553678000000003,"Oshkosh, WI","Oshkosh-Neenah, WI Metropolitan Statistical Area",3.6,2.4,2.2,2.3,2.8,3.0,2.6,13.5,0.2,0.4,0.6,0.4,-0.3,92688.0,0.8
LAUMT553954000000003,"Racine, WI","Racine, WI Metropolitan Statistical Area",5.5,3.5,3.1,3.3,3.9,4.0,3.7,15.2,0.5,0.6,0.4,0.6,-0.2,99164.0,0.3
LAUMT554310000000003,"Sheboygan, WI","Sheboygan, WI Metropolitan Statistical Area",3.5,2.3,2.0,2.0,2.5,2.8,2.4,14.2,0.1,0.4,0.5,0.4,-0.2,62613.0,1.0
LAUMT554814000000003,"Wausau, WI","Wausau, WI Metropolitan Statistical Area",3.3,2.5,2.4,2.5,3.0,3.2,2.7,11.6,0.4,0.5,0.5,0.3,-0.1,72573.0,-1.4
LAUMT561622000000003,"Casper, WY","Casper, WY Metropolitan Statistical Area",7.3,4.1,3.2,3.9,3.8,3.5,3.0,6.5,1.0,0.3,-0.5,-0.2,-1.0,39317.0,-2.2
LAUMT561694000000003,"Cheyenne, WY","Cheyenne, WY Metropolitan Statistical Area",4.5,3.3,2.9,3.8,3.7,3.4,2.9,4.7,1.0,0.3,-0.1,0.0,-0.6,48771.0,-1.5
