LAUMT223538000000003,"New Orleans, LA","New Orleans-Metairie, LA Metropolitan Statistical Area",10.7,6.0,4.0,4.0,4.5,3.4,3.6,17.0,0.5,0.3,-0.9,-0.4,-0.7,587073.0,-3.0
LAUMT224334000000003,"Shreveport, LA","Shreveport-Bossier City, LA Metropolitan Statistical Area",8.8,5.3,4.1,4.1,4.6,3.4,3.5,11.7,0.6,0.2,-1.0,-0.6,-1.4,183996.0,-3.2
LAUMT237075000000003,"Bangor, ME","Bangor, ME Metropolitan NECTA",3.4,4.3,2.3,2.3,2.5,2.5,2.6,8.6,-0.0,0.2,0.0,0.3,-0.3,68889.0,-2.4
LAUMT237465000000003,"Lewiston, ME","Lewiston-Auburn, ME Metropolitan NECTA",3.9,5.0,2.4,2.7,2.7,2.7,2.7,8.7,-0.1,0.0,0.0,0.3,-0.2,53564.0,-3.5
LAUMT237675000000003,"Portland, ME","Portland-South Portland, ME Metropolitan NECTA",3.7,3.8,1.9,2.2,2.2,2.2,2.2,9.6,0.0,0.0,0.1,0.3,-0.2,213155.0,-0.5
LAUMT241258000000003,"Baltimore, MD","Baltimore-Columbia-Towson, MD Metropolitan Statistical Area",6.7,5.1,3.5,2.2,1.7,1.8,1.8,9.0,-0.5,-0.4,-1.6,-1.7,-1.6,1503853.0,-4.9
LAUMT241568000000003,"California, MD","California-Lexington Park, MD Metropolitan Statistical Area",4.9,4.5,3.7,2.1,1.7,1.8,1.9,6.2,-0.3,-0.1,-1.8,-1.8,-1.3,57621.0,-2.8
LAUMT241906000000003,"Cumberland, MD","Cumberland, MD-WV Metropolitan Statistical Area",6.8,5.5,4.3,2.9,2.7,2.6,2.9,12.3,-0.6,-0.2,-1.6,-1.4,-2.2,43889.0,-3.8
LAUMT242518000000003,"Hagerstown, MD","Hagerstown-Martinsburg, MD-WV Metropolitan Statistical Area",6.6,4.4,3.5,2.7,2.6,2.6,3.0,11.0,-0.2,0.1,-0.8,-0.5,-0.7,131473.0,-4.0
LAUMT257090000000003,"Barnstable Town, MA","Barnstable Town, MA Metropolitan NECTA",9.6,5.0,3.6,2.5,2.7,2.7,2.6,21.6,-2.5,-1.1,-0.9,-1.0,-1.3,133571.0,-7.8
LAUMT257165000000003,"Boston, MA","Boston-Cambridge-Nashua, MA-NH Metropolitan NECTA",10.0,4.8,3.6,2.2,2.7,2.7,2.7,15.8,-0.6,0.1,-0.9,-0.9,-0.0,2794089.0,-3.0
LAUMT257450000000003,"Leominster, MA","Leominster-Gardner, MA Metropolitan NECTA",11.7,6.0,4.5,2.5,3.0,3.2,3.2,17.8,-1.4,-0.2,-1.3,-1.3,-0.4,77257.0,-5.1
LAUMT257555000000003,"New Bedford, MA","New Bedford, MA Metropolitan NECTA",12.1,6.6,5.3,3.0,3.6,3.8,3.8,23.4,-1.9,-0.4,-1.5,-1.5,-0.8,83194.0,-4.4
LAUMT257660000000003,"Pittsfield, MA","Pittsfield, MA Metropolitan NECTA",11.1,5.9,4.1,2.5,3.0,3.0,2.9,19.0,-1.6,-0.5,-1.2,-1.2,-1.0,39855.0,-10.7
LAUMT257810000000003,"Springfield, MA","Springfield, MA-CT Metropolitan NECTA",10.7,6.0,4.6,2.6,3.3,3.4,3.3,15.1,-0.8,0.2,-1.3,-1.3,-0.5,362145.0,-5.0
LAUMT257960000000003,"Worcester, MA","Worcester, MA-CT Metropolitan NECTA",9.9,5.4,4.0,2.5,3.0,3.1,3.0,14.8,-0.8,0.0,-1.0,-1.0,-0.3,354048.0,-3.3
LAUMT261146000000003,"Ann Arbor, MI","Ann Arbor, MI Metropolitan Statistical Area",7.2,4.5,3.9,3.6,3.9,4.0,3.9,14.3,0.7,0.7,-0.5,0.0,1.0,206085.0,3.9
LAUMT261298000000003,"Battle Creek, MI","Battle Creek, MI Metropolitan Statistical Area",9.5,6.7,5.2,4.6,4.9,5.1,4.8,23.3,0.2,0.5,-0.5,-0.4,0.6,61609.0,-2.0
LAUMT261302000000003,"Bay City, MI","Bay City, MI Metropolitan Statistical Area",8.2,5.9,5.2,4.9,5.1,5.2,5.0,24.2,-0.6,-0.0,-0.5,-0.2,0.3,51227.0,1.1
LAUMT261982000000003,"Detroit, MI","Detroit-Warren-Dearborn, MI Metropolitan Statistical Area",11.4,6.5,3.7,3.1,3.7,3.9,4.1,23.4,0.7,1.3,0.2,0.4,-0.1,2212984.0,-0.6
LAUMT262242000000003,"Flint, MI","Flint, MI Metropolitan Statistical Area",10.7,9.5,5.8,5.1,5.4,5.5,5.3,29.9,-0.1,0.3,-0.9,-0.5,0.3,185952.0,1.2
LAUMT262434000000003,"Grand Rapids, MI","Grand Rapids-Wyoming, MI Metropolitan Statistical Area",7.3,4.6,3.7,3.4,3.7,3.8,3.6,20.2,0.3,0.5,-0.3,-0.1,0.7,611462.0,4.3
LAUMT262710000000003,"Jackson, MI","Jackson, MI Metropolitan Statistical Area",8.7,5.9,4.7,4.2,4.4,4.6,4.4,22.7,0.1,0.4,-0.6,-0.3,0.6,75895.0,1.5
LAUMT262802000000003,"Kalamazoo, MI","Kalamazoo-Portage, MI Metropolitan Statistical Area",7.8,5.4,4.5,4.1,4.4,4.5,4.3,17.0,0.2,0.5,-0.3,-0.2,0.7,171423.0,1.4
LAUMT262962000000003,"Lansing, MI","Lansing-East Lansing, MI Metropolitan Statistical Area",7.5,6.5,4.9,3.9,4.2,4.4,4.1,18.2,0.3,0.5,-1.6,-0.8,0.6,249425.0,1.4
LAUMT263322000000003,"Midland, MI","Midland, MI Metropolitan Statistical Area",7.1,4.6,4.5,4.1,4.3,4.2,4.1,19.1,-0.3,0.0,-0.6,-0.4,0.3,41843.0,3.4
LAUMT263378000000003,"Monroe, MI","Monroe, MI Metropolitan Statistical Area",7.9,6.2,4.9,4.8,4.5,4.6,4.4,25.4,0.2,0.2,-1.1,-0.5,0.5,76280.0,-0.3
LAUMT263474000000003,"Muskegon, MI","Muskegon, MI Metropolitan Statistical Area",11.2,7.4,5.4,4.7,5.0,5.2,4.8,28.5,0.2,0.5,-0.5,-0.6,0.5,79820.0,0.5
LAUMT263566000000003,"Niles, MI","Niles-Benton Harbor, MI Metropolitan Statistical Area",8.8,5.7,4.7,4.3,4.6,4.7,4.5,19.3,0.0,0.4,-0.4,-0.2,0.5,75498.0,-0.3
LAUMT264098000000003,"Saginaw, MI","Saginaw, MI Metropolitan Statistical Area",9.7,7.6,5.8,5.3,5.5,5.6,5.3,25.3,-0.4,0.1,-0.7,-0.5,0.5,86026.0,-1.8
LAUMT272026000000003,"Duluth, MN","Duluth, MN-WI Metropolitan Statistical Area",7.1,3.9,3.4,3.7,4.1,3.7,3.6,12.4,-0.1,0.1,0.4,0.2,-0.5,141791.0,-0.5
LAUMT273186000000003,"Mankato, MN","Mankato-North Mankato, MN Metropolitan Statistical Area",5.5,3.3,2.2,2.4,2.7,2.7,2.6,7.6,0.0,0.3,0.5,0.4,-0.1,62356.0,3.7
LAUMT273346000000003,"Minneapolis, MN","Minneapolis-St. Paul-Bloomington, MN-WI Metropolitan Statistical Area",6.9,3.6,2.7,2.9,3.3,3.2,3.2,9.2,0.2,0.4,0.7,0.5,0.2,2039333.0,-0.6
LAUMT274034000000003,"Rochester, MN","Rochester, MN Metropolitan Statistical Area",5.0,2.9,2.3,2.4,2.8,2.6,2.6,6.7,-0.1,0.2,0.4,0.3,-0.2,130823.0,2.4
LAUMT274106000000003,"St. Cloud, MN","St. Cloud, MN Metropolitan Statistical Area",5.3,3.8,2.6,2.8,3.6,3.5,3.4,8.2,-0.2,0.4,1.0,0.8,0.0,111358.0,-1.6
LAUMT282506000000003,"Gulfport, MS","Gulfport-Biloxi-Pascagoula, MS Metropolitan Statistical Area",7.6,5.6,4.1,3.0,3.9,3.8,3.9,20.5,0.6,1.0,-0.8,-0.2,-1.7,164222.0,-2.9
LAUMT282562000000003,"Hattiesburg, MS","Hattiesburg, MS Metropolitan Statistical Area",6.7,5.0,3.6,2.6,3.6,3.5,3.5,12.2,0.6,1.0,-0.6,-0.1,-1.4,68172.0,-1.1
LAUMT282714000000003,"Jackson, MS","Jackson, MS Metropolitan Statistical Area",6.5,5.1,3.6,2.6,3.5,3.4,3.5,13.9,0.5,0.9,-0.7,-0.1,-1.4,261794.0,-4.1
LAUMT291602000000003,"Cape Girardeau, MO","Cape Girardeau, MO-IL Metropolitan Statistical Area",5.2,3.7,2.8,2.8,3.3,3.4,3.3,10.3,0.8,0.8,0.6,0.5,0.2,48380.0,2.2
LAUMT291786000000003,"Columbia, MO","Columbia, MO Metropolitan Statistical Area",4.7,2.8,2.3,2.5,2.8,2.8,2.7,7.3,0.7,0.6,0.6,0.4,0.4,103375.0,6.5
LAUMT292762000000003,"Jefferson City, MO","Jefferson City, MO Metropolitan Statistical Area",5.2,3.0,2.5,2.5,2.9,3.0,2.9,6.9,0.7,0.7,0.6,0.4,0.3,77613.0,2.1
LAUMT292790000000003,"Joplin, MO","Joplin, MO Metropolitan Statistical Area",5.8,3.5,2.7,3.0,3.4,3.4,3.2,11.0,0.8,0.7,0.8,0.5,0.2,85863.0,1.0
LAUMT292814000000003,"Kansas City, MO","Kansas City, MO-KS Metropolitan Statistical Area",6.3,4.0,3.0,2.8,3.1,3.2,3.4,12.0,0.3,0.5,0.1,0.4,0.1,1187339.0,1.2
LAUMT294114000000003,"St. Joseph, MO","St. Joseph, MO-KS Metropolitan Statistical Area",4.9,3.5,2.8,2.7,3.2,3.2,3.1,7.6,0.5,0.6,0.5,0.3,0.1,60726.0,-5.5
LAUMT294118000000003,"St. Louis, MO","St. Louis, MO-IL Metropolitan Statistical Area",7.2,4.6,3.0,3.0,3.5,3.6,3.7,11.7,0.6,0.8,0.7,0.7,0.5,1505893.0,-0.0
LAUMT294418000000003,"Springfield, MO","Springfield, MO Metropolitan Statistical Area",5.2,3.2,2.4,2.6,2.9,2.8,2.9,9.9,0.6,0.5,0.6,0.5,0.1,243763.0,2.7
LAUMT301374000000003,"Billings, MT","Billings, MT Metropolitan Statistical Area",5.0,3.0,2.4,2.2,2.7,2.4,2.5,11.1,0.1,0.3,-0.1,0.1,-0.7,93933.0,5.1
LAUMT302450000000003,"Great Falls, MT","Great Falls, MT Metropolitan Statistical Area",5.5,3.1,2.5,2.4,2.7,2.5,2.5,12.3,-0.0,0.1,-0.1,0.0,-0.9,39483.0,3.7
LAUMT303354000000003,"Missoula, MT","Missoula, MT Metropolitan Statistical Area",5.7,3.0,2.4,2.3,2.6,2.4,2.5,13.7,-0.2,0.0,0.0,0.1,-0.8,68457.0,6.4
LAUMT312426000000003,"Grand Island, NE","Grand Island, NE Metropolitan Statistical Area",4.5,2.6,2.3,2.0,2.4,2.2,1.8,9.6,0.1,0.2,-0.2,-0.5,-1.7,45736.0,1.3
LAUMT313070000000003,"Lincoln, NE","Lincoln, NE Metropolitan Statistical Area",3.6,2.4,2.3,2.0,2.4,2.1,1.8,8.6,0.3,0.2,-0.3,-0.5,-1.0,189614.0,-0.2
LAUMT313654000000003,"Omaha, NE","Omaha-Council Bluffs, NE-IA Metropolitan Statistical Area",4.2,3.0,2.7,2.2,2.6,2.5,2.2,9.2,0.2,0.3,-0.3,-0.5,-0.9,507677.0,-1.0
LAUMT321618000000003,"Carson City, NV","Carson City, NV Metropolitan Statistical Area",7.5,4.4,4.2,4.4,4.8,4.8,4.8,21.2,-0.3,0.1,0.8,0.6,0.7,26343.0,-0.7
LAUMT322982000000003,"Las Vegas, NV","Las Vegas-Henderson-Paradise, NV Metropolitan Statistical Area",16.2,7.5,6.2,5.6,6.0,6.1,6.1,34.0,0.2,0.5,-0.1,-0.1,1.8,1195494.0,4.8
LAUMT323990000000003,"Reno, NV","Reno, NV Metropolitan Statistical Area",7.5,4.0,3.8,4.1,4.5,4.4,4.5,20.3,0.0,0.3,0.8,0.7,1.1,267644.0,3.6
LAUMT337305000000003,"Dover, NH","Dover-Durham, NH-ME Metropolitan NECTA",5.7,2.9,2.4,1.5,1.8,1.9,2.3,14.1,0.0,0.5,-0.5,-0.1,-0.1,84764.0,-2.9
LAUMT337495000000003,"Manchester, NH","Manchester, NH Metropolitan NECTA",6.6,3.1,2.7,1.4,1.7,1.8,2.2,16.0,-0.1,0.4,-0.6,-0.5,-0.2,120379.0,-2.3
LAUMT337690000000003,"Portsmouth, NH","Portsmouth, NH-ME Metropolitan NECTA",5.3,2.8,2.3,1.5,1.7,1.8,2.0,13.9,-0.2,0.2,-0.2,-0.3,-0.3,77906.0,-3.8
LAUMT341210000000003,"Atlantic City, NJ","Atlantic City-Hammonton, NJ Metropolitan Statistical Area",20.4,9.5,4.1,5.0,5.5,5.7,6.1,31.0,0.3,1.0,1.1,2.0,1.2,128930.0,-0.8
LAUMT343614000000003,"Ocean City, NJ","Ocean City, NJ Metropolitan Statistical Area",11.9,6.3,3.1,6.1,4.9,4.5,4.7,25.0,-4.1,-2.8,0.9,1.6,-2.7,59948.0,0.6
LAUMT344594000000003,"Trenton, NJ","Trenton, NJ Metropolitan Statistical Area",10.1,5.6,2.8,3.3,4.1,4.3,4.5,9.8,0.8,1.2,1.1,1.7,1.4,224819.0,5.2
LAUMT344722000000003,"Vineland, NJ","Vineland-Bridgeton, NJ Metropolitan Statistical Area",13.3,8.3,4.4,5.4,6.1,6.9,7.3,14.8,0.5,1.5,2.0,2.9,2.0,71523.0,7.6
LAUMT351074000000003,"Albuquerque, NM","Albuquerque, NM Metropolitan Statistical Area",8.2,6.6,3.4,3.1,4.2,4.6,4.1,9.0,0.9,1.4,0.7,0.7,-0.6,449694.0,2.2
LAUMT352214000000003,"Farmington, NM","Farmington, NM Metropolitan Statistical Area",10.2,8.1,4.1,3.8,5.4,5.5,4.8,9.6,1.0,1.6,0.5,0.7,-1.0,49370.0,-4.9
LAUMT352974000000003,"Las Cruces, NM","Las Cruces, NM Metropolitan Statistical Area",7.7,6.8,3.8,4.1,5.3,5.3,4.5,8.3,0.7,1.1,0.7,0.7,-1.3,100231.0,3.0
LAUMT354214000000003,"Santa Fe, NM","Santa Fe, NM Metropolitan Statistical Area",8.5,6.2,3.3,2.9,3.9,4.4,4.0,9.4,0.9,1.4,0.6,0.7,-0.1,73105.0,-3.6
LAUMT361058000000003,"Albany, NY","Albany-Schenectady-Troy, NY Metropolitan Statistical Area",6.6,4.3,3.3,2.7,2.9,2.9,3.1,14.1,0.0,0.3,-0.3,-0.2,-0.4,474095.0,1.9
LAUMT361378000000003,"Binghamton, NY","Binghamton, NY Metropolitan Statistical Area",7.4,4.9,3.9,3.0,3.4,3.4,3.7,17.6,-0.2,0.4,-0.5,-0.2,-0.7,105149.0,-3.6
LAUMT361538000000003,"Buffalo, NY","Buffalo-Cheektowaga-Niagara Falls, NY Metropolitan Statistical Area",8.4,5.3,4.0,3.1,3.2,3.3,3.8,21.6,-0.3,0.3,-0.5,-0.2,-0.4,558088.0,-0.3
LAUMT362130000000003,"Elmira, NY","Elmira, NY Metropolitan Statistical Area",7.6,5.1,4.0,3.3,3.6,3.6,3.9,18.4,-0.1,0.4,-0.3,-0.1,-0.1,35137.0,-2.8
LAUMT362402000000003,"Glens Falls, NY","Glens Falls, NY Metropolitan Statistical Area",6.0,4.2,3.1,2.8,2.8,2.7,3.0,17.6,-0.8,-0.3,-0.4,-0.1,-1.2,62302.0,-2.7
LAUMT362706000000003,"Ithaca, NY","Ithaca, NY Metropolitan Statistical Area",5.7,4.0,3.2,2.5,3.0,2.9,3.2,11.3,0.4,0.7,-0.4,0.0,-0.3,50561.0,2.4
LAUMT362874000000003,"Kingston, NY","Kingston, NY Metropolitan Statistical Area",7.3,4.6,3.5,2.8,3.1,3.1,3.5,17.3,0.0,0.5,-0.3,0.0,-0.1,89507.0,-2.0
LAUMT363562000000003,"New York, NY","New York-Newark-Jersey City, NY-NJ-PA Metropolitan Statistical Area",12.6,7.5,4.0,4.1,4.6,4.6,4.9,14.2,0.3,0.7,0.4,0.9,1.3,10444797.0,-0.0
LAUMT364038000000003,"Rochester, NY","Rochester, NY Metropolitan Statistical Area",7.5,4.8,3.7,2.9,3.1,3.2,3.5,16.5,-0.1,0.4,-0.4,-0.2,-0.5,533677.0,-0.8
LAUMT364506000000003,"Syracuse, NY","Syracuse, NY Metropolitan Statistical Area",7.3,4.8,3.7,3.0,3.2,3.2,3.5,17.9,-0.1,0.3,-0.4,-0.2,-0.6,321391.0,1.2
LAUMT364654000000003,"Utica, NY","Utica-Rome, NY Metropolitan Statistical Area",7.1,5.0,3.8,3.1,3.3,3.2,3.6,16.9,-0.3,0.2,-0.6,-0.2,-0.6,130373.0,-3.1
LAUMT364806000000003,"Watertown, NY","Watertown-Fort Drum, NY Metropolitan Statistical Area",6.7,4.8,4.0,3.4,3.4,3.5,3.8,18.7,-0.8,-0.2,-0.3,-0.2,-1.5,45962.0,-1.1
LAUMT371170000000003,"Asheville, NC","Asheville, NC Metropolitan Statistical Area",6.9,4.2,3.4,2.8,2.9,2.9,2.9,17.9,0.1,0.2,-0.3,-0.5,-0.2,244124.0,3.6
LAUMT371550000000003,"Burlington, NC","Burlington, NC Metropolitan Statistical Area",6.6,5.0,4.3,3.5,3.8,3.8,3.7,13.6,0.3,0.3,-0.3,-0.6,-0.1,84218.0,2.0
LAUMT371674000000003,"Charlotte, NC","Charlotte-Concord-Gastonia, NC-SC Metropolitan Statistical Area",6.9,4.6,3.9,3.2,3.4,3.4,3.3,13.5,0.1,0.2,-0.2,-0.6,-0.2,1477292.0,8.7
LAUMT372050000000003,"Durham, NC","Durham-Chapel Hill, NC Metropolitan Statistical Area",5.7,4.1,3.6,3.1,3.2,3.2,3.2,10.4,0.2,0.2,-0.2,-0.4,-0.2,327237.0,6.5
LAUMT372218000000003,"Fayetteville, NC","Fayetteville, NC Metropolitan Statistical Area",8.8,6.8,5.9,4.7,5.0,5.0,4.9,15.8,0.2,0.3,-0.6,-1.0,-0.1,146091.0,-0.3
LAUMT372414000000003,"Goldsboro, NC","Goldsboro, NC Metropolitan Statistical Area",5.9,5.2,4.6,3.8,3.9,3.9,4.0,10.1,0.2,0.3,-0.5,-0.6,-0.1,50992.0,-1.0
LAUMT372466000000003,"Greensboro, NC","Greensboro-High Point, NC Metropolitan Statistical Area",7.8,5.5,4.7,3.8,4.1,4.1,4.0,15.9,0.3,0.4,-0.3,-0.7,-0.0,369102.0,1.2
LAUMT372478000000003,"Greenville, NC","Greenville, NC Metropolitan Statistical Area",6.4,5.4,4.8,4.0,4.2,4.4,4.3,10.5,0.4,0.5,-0.2,-0.5,0.1,88952.0,1.1
LAUMT372586000000003,"Hickory, NC","Hickory-Lenoir-Morganton, NC Metropolitan Statistical Area",6.6,4.6,3.9,3.3,3.5,3.4,3.4,18.7,0.2,0.3,-0.2,-0.5,-0.3,175349.0,1.3
LAUMT372734000000003,"Jacksonville, NC","Jacksonville, NC Metropolitan Statistical Area",6.3,5.3,5.0,4.0,4.2,4.3,4.2,13.6,0.3,0.4,-0.5,-0.8,-0.4,69831.0,12.1
LAUMT373510000000003,"New Bern, NC","New Bern, NC Metropolitan Statistical Area",5.7,4.7,4.1,3.5,3.5,3.5,3.5,11.4,0.0,0.1,-0.3,-0.6,-0.5,52572.0,1.2
LAUMT373958000000003,"Raleigh, NC","Raleigh, NC Metropolitan Statistical Area",5.9,4.1,3.6,3.1,3.2,3.2,3.2,12.0,0.2,0.2,-0.1,-0.4,-0.2,803004.0,10.5
LAUMT374058000000003,"Rocky Mount, NC","Rocky Mount, NC Metropolitan Statistical Area",9.0,6.9,6.4,4.8,5.2,5.2,5.0,13.9,0.1,0.3,-0.7,-1.4,-0.1,62011.0,-2.4
LAUMT374890000000003,"Wilmington, NC","Wilmington, NC Metropolitan Statistical Area",6.2,4.3,3.7,3.1,3.3,3.3,3.4,15.9,0.1,0.3,-0.2,-0.3,-0.2,162381.0,6.0
LAUMT374918000000003,"Winston-Salem, NC","Winston-Salem, NC Metropolitan Statistical Area",6.5,4.8,4.1,3.3,3.6,3.5,3.5,13.8,0.2,0.3,-0.4,-0.6,-0.2,336419.0,2.6
LAUMT381390000000003,"Bismarck, ND","Bismarck, ND Metropolitan Statistical Area",4.3,2.4,2.0,1.9,2.3,1.8,1.5,8.5,-0.5,-0.4,-0.1,-0.5,-0.9,70983.0,-0.5
LAUMT382202000000003,"Fargo, ND","Fargo, ND-MN Metropolitan Statistical Area",4.1,2.2,1.8,1.9,2.2,1.9,1.6,7.8,-0.3,-0.2,0.2,-0.2,-0.6,148770.0,4.2
LAUMT382422000000003,"Grand Forks, ND","Grand Forks, ND-MN Metropolitan Statistical Area",4.7,2.8,2.2,2.2,2.7,2.4,2.0,8.3,-0.1,0.1,0.2,-0.2,-0.5,54690.0,0.3
LAUMT391042000000003,"Akron, OH","Akron, OH Metropolitan Statistical Area",8.2,4.9,4.2,3.4,3.8,3.5,3.9,14.4,-0.4,0.1,-0.8,-0.3,-0.4,353110.0,-3.7
LAUMT391594000000003,"Canton, OH","Canton-Massillon, OH Metropolitan Statistical Area",7.8,4.8,4.2,3.5,3.7,3.4,3.8,14.9,-0.4,-0.0,-0.8,-0.4,-0.8,195998.0,-3.1
LAUMT391714000000003,"Cincinnati, OH","Cincinnati, OH-KY-IN Metropolitan Statistical Area",7.0,4.2,3.7,3.1,3.5,3.4,3.5,13.0,0.1,0.4,-0.5,-0.2,-0.2,1171566.0,1.2
LAUMT391746000000003,"Cleveland, OH","Cleveland-Elyria, OH Metropolitan Statistical Area",9.6,5.4,4.5,3.8,4.4,3.5,3.7,20.5,-0.3,0.1,-1.4,-0.8,-0.4,1054109.0,-3.7
LAUMT391814000000003,"Columbus, OH","Columbus, OH Metropolitan Statistical Area",7.4,4.3,3.7,3.0,3.3,3.1,3.4,12.6,-0.1,0.2,-0.6,-0.3,-0.2,1141397.0,1.1
LAUMT391938000000003,"Dayton, OH","Dayton, OH Metropolitan Statistical Area",8.1,4.9,4.2,3.4,3.8,3.5,3.8,15.0,-0.1,0.2,-0.8,-0.4,-0.3,393395.0,-1.4
LAUMT393062000000003,"Lima, OH","Lima, OH Metropolitan Statistical Area",7.6,5.0,4.2,3.7,4.2,3.7,4.1,18.9,-0.1,0.2,-0.5,-0.1,0.0,46707.0,-4.8
LAUMT393190000000003,"Mansfield, OH","Mansfield, OH Metropolitan Statistical Area",8.0,5.5,4.6,3.8,4.1,4.0,4.1,19.3,-0.6,-0.1,-0.8,-0.5,-0.5,51089.0,-4.6
LAUMT394422000000003,"Springfield, OH","Springfield, OH Metropolitan Statistical Area",7.7,4.9,4.2,3.3,3.7,3.6,3.7,16.5,-0.1,0.2,-1.0,-0.5,-0.7,64231.0,-0.6
LAUMT394578000000003,"Toledo, OH","Toledo, OH Metropolitan Statistical Area",8.7,5.4,4.4,3.8,4.0,3.7,4.0,20.5,-0.3,0.0,-0.7,-0.4,-0.4,295519.0,-4.1
LAUMT394826000000003,"Weirton, WV","Weirton-Steubenville, WV-OH Metropolitan Statistical Area",9.8,6.5,5.7,4.3,5.1,5.1,5.8,17.4,-0.2,0.7,-0.4,0.1,0.2,50563.0,-2.7
LAUMT394966000000003,"Youngstown, OH","Youngstown-Warren-Boardman, OH-PA Metropolitan Statistical Area",10.0,6.2,5.2,4.0,4.3,4.1,4.5,18.8,-0.5,0.1,-1.1,-0.7,-1.2,231118.0,-5.5
LAUMT403002000000003,"Lawton, OK","Lawton, OK Metropolitan Statistical Area",6.1,4.1,3.9,3.5,3.7,3.6,4.1,16.0,0.5,0.7,-0.1,0.2,0.6,51833.0,1.5
LAUMT403642000000003,"Oklahoma City, OK","Oklahoma City, OK Metropolitan Statistical Area",6.1,3.6,3.1,2.7,2.8,2.8,3.2,12.7,0.2,0.4,-0.1,0.1,0.3,741267.0,7.0
LAUMT404614000000003,"Tulsa, OK","Tulsa, OK Metropolitan Statistical Area",6.5,3.9,3.4,2.9,3.0,3.1,3.3,12.8,0.2,0.4,-0.1,-0.1,0.2,505399.0,3.6
LAUMT411054000000003,"Albany, OR","Albany, OR Metropolitan Statistical Area",7.7,5.5,5.1,3.6,3.9,4.2,4.1,14.1,-0.1,0.5,-0.6,-1.0,-0.2,60534.0,4.3
LAUMT411346000000003,"Bend, OR","Bend-Redmond, OR Metropolitan Statistical Area",7.3,4.7,4.4,3.2,3.4,3.7,3.7,16.6,-0.4,0.3,-0.4,-0.7,-0.2,102310.0,5.2
LAUMT411870000000003,"Corvallis, OR","Corvallis, OR Metropolitan Statistical Area",6.2,4.2,4.3,2.4,3.1,3.4,3.3,9.5,0.2,0.9,-0.7,-1.0,0.3,47616.0,4.8
LAUMT412166000000003,"Eugene, OR","Eugene, OR Metropolitan Statistical Area",8.2,5.5,5.2,3.4,3.8,4.2,4.2,14.4,-0.1,0.6,-0.6,-1.0,0.2,176246.0,-1.4
LAUMT412442000000003,"Grants Pass, OR","Grants Pass, OR Metropolitan Statistical Area",7.9,6.2,6.2,4.1,4.6,4.9,5.1,14.0,-0.6,0.5,-0.9,-1.1,0.2,36272.0,1.3
LAUMT413278000000003,"Medford, OR","Medford, OR Metropolitan Statistical Area",7.8,5.4,5.4,3.7,4.1,4.7,4.4,14.4,-0.3,0.6,-0.2,-1.0,0.1,105476.0,1.9
LAUMT413890000000003,"Portland, OR","Portland-Vancouver-Hillsboro, OR-WA Metropolitan Statistical Area",8.4,4.9,4.4,3.0,3.3,3.6,3.7,13.2,-0.3,0.4,-0.4,-0.7,0.2,1369375.0,3.1
LAUMT414142000000003,"Salem, OR","Salem, OR Metropolitan Statistical Area",6.7,5.0,4.8,3.2,3.6,3.9,3.8,11.8,-0.1,0.5,-0.6,-1.0,-0.1,212609.0,3.6
LAUMT421090000000003,"Allentown, PA","Allentown-Bethlehem-Easton, PA-NJ Metropolitan Statistical Area",9.8,6.4,4.8,3.7,4.1,4.0,4.6,15.8,0.0,0.6,-0.7,-0.2,0.2,457195.0,0.8
LAUMT421102000000003,"Altoona, PA","Altoona, PA Metropolitan Statistical Area",8.1,6.2,5.4,3.3,3.9,3.8,4.2,17.0,-0.1,0.6,-1.4,-1.2,-0.3,59695.0,-3.3
LAUMT421410000000003,"Bloomsburg, PA","Bloomsburg-Berwick, PA Metropolitan Statistical Area",7.0,5.7,5.0,3.5,4.0,3.7,4.2,14.0,-0.3,0.4,-1.2,-0.8,-0.3,43567.0,0.5
LAUMT421654000000003,"Chambersburg, PA","Chambersburg-Waynesboro, PA Metropolitan Statistical Area",7.7,5.3,4.4,3.0,3.2,3.2,3.7,12.4,-0.1,0.4,-1.1,-0.7,-0.1,79413.0,-0.7
LAUMT422070000000003,"East Stroudsburg, PA","East Stroudsburg, PA Metropolitan Statistical Area",11.2,7.6,6.7,4.7,4.9,4.7,5.4,20.5,-0.5,0.2,-1.5,-1.3,0.1,83283.0,-3.3
LAUMT422150000000003,"Erie, PA","Erie, PA Metropolitan Statistical Area",9.7,6.9,5.6,3.8,4.1,4.7,5.2,16.5,-0.3,0.7,-0.6,-0.4,0.7,126513.0,-4.1
LAUMT422390000000003,"Gettysburg, PA","Gettysburg, PA Metropolitan Statistical Area",6.5,4.8,4.3,2.8,3.2,3.1,3.6,14.6,0.3,0.7,-0.9,-0.7,0.3,55638.0,-1.9
LAUMT422542000000003,"Harrisburg, PA","Harrisburg-Carlisle, PA Metropolitan Statistical Area",7.9,5.6,4.5,3.1,3.4,3.3,3.9,13.0,0.1,0.6,-1.0,-0.6,0.2,316722.0,1.3
LAUMT422778000000003,"Johnstown, PA","Johnstown, PA Metropolitan Statistical Area",9.3,7.5,6.6,4.1,4.9,4.7,5.3,16.9,-0.2,0.8,-1.8,-1.3,0.0,55459.0,-6.0
LAUMT422954000000003,"Lancaster, PA","Lancaster, PA Metropolitan Statistical Area",7.4,5.2,4.3,2.9,3.2,3.2,3.6,14.2,0.2,0.7,-1.0,-0.7,0.2,297989.0,0.9
LAUMT423014000000003,"Lebanon, PA","Lebanon, PA Metropolitan Statistical Area",7.9,5.7,4.6,3.1,3.4,3.3,3.8,13.7,0.2,0.6,-1.1,-0.8,-0.1,76216.0,1.7
LAUMT423798000000003,"Philadelphia, PA","Philadelphia-Camden-Wilmington, PA-NJ-DE-MD Metropolitan Statistical Area",10.4,6.4,4.6,3.6,3.9,4.0,4.5,14.0,0.2,0.7,-0.5,-0.1,0.4,3289771.0,2.5
LAUMT423830000000003,"Pittsburgh, PA","Pittsburgh, PA Metropolitan Statistical Area",9.5,6.3,5.3,3.6,3.8,3.7,4.3,15.8,-0.3,0.4,-1.3,-1.0,0.0,1189492.0,-4.1
LAUMT423974000000003,"Reading, PA","Reading, PA Metropolitan Statistical Area",9.7,6.5,5.1,3.7,4.0,3.8,4.5,17.3,0.0,0.6,-1.0,-0.6,0.2,216815.0,-2.2
LAUMT424254000000003,"Scranton, PA","Scranton--Wilkes-Barre--Hazleton, PA Metropolitan Statistical Area",10.3,7.5,5.9,4.1,4.4,4.4,5.0,17.1,-0.4,0.4,-1.2,-0.9,-0.3,282086.0,-0.0
LAUMT424430000000003,"State College, PA","State College, PA Metropolitan Statistical Area",5.5,5.1,4.4,2.9,3.5,3.2,3.7,9.7,0.2,0.7,-1.2,-0.7,0.4,77669.0,-0.5
LAUMT424870000000003,"Williamsport, PA","Williamsport, PA Metropolitan Statistical Area",8.4,6.7,5.3,3.6,3.9,3.7,4.2,15.2,-0.5,0.2,-1.5,-1.1,-0.6,55260.0,-4.5
LAUMT424962000000003,"York, PA","York-Hanover, PA Metropolitan Statistical Area",8.0,5.7,4.7,3.1,3.6,3.5,4.0,14.9,0.2,0.7,-1.0,-0.7,0.2,241310.0,-0.3
LAUMT447720000000003,"Providence, RI","Providence-Warwick, RI-MA Metropolitan NECTA",10.6,6.0,4.1,2.8,3.0,2.6,3.2,18.4,-0.8,-0.2,-1.0,-0.9,-0.4,704034.0,-1.5
LAUMT451670000000003,"Charleston, SC","Charleston-North Charleston, SC Metropolitan Statistical Area",6.3,3.7,3.1,2.4,3.0,2.9,2.1,11.0,0.1,0.3,0.0,-1.0,-0.2,430186.0,9.5
LAUMT451790000000003,"Columbia, SC","Columbia, SC Metropolitan Statistical Area",5.5,3.9,3.4,2.7,3.4,3.4,2.3,7.7,0.2,0.3,0.2,-1.1,-0.3,411188.0,3.8
LAUMT452250000000003,"Florence, SC","Florence, SC Metropolitan Statistical Area",6.3,4.4,3.7,2.9,3.6,3.7,2.5,8.3,0.2,0.3,0.1,-1.2,-0.5,99277.0,3.2
LAUMT452486000000003,"Anderson, SC","Greenville-Anderson-Mauldin, SC Metropolitan Statistical Area",5.4,3.7,3.2,2.7,3.3,3.3,2.2,11.3,0.2,0.2,0.2,-1.0,-0.3,452667.0,5.7
LAUMT452486000000003,"Anderson, SC","Greenville-Anderson-Mauldin, SC Metropolitan Statistical Area",5.4,3.7,3.2,2.7,3.3,3.3,2.2,11.3,0.2,0.2,0.2,-1.0,-0.3,452667.0,5.7
LAUMT452486000000003,"Greenville, SC","Greenville-Anderson-Mauldin, SC Metropolitan Statistical Area",5.4,3.7,3.2,2.7,3.3,3.3,2.2,11.3,0.2,0.2,0.2,-1.0,-0.3,452667.0,5.7
LAUMT452486000000003,"Greenville, SC","Greenville-Anderson-Mauldin, SC Metropolitan Statistical Area",5.4,3.7,3.2,2.7,3.3,3.3,2.2,11.3,0.2,0.2,0.2,-1.0,-0.3,452667.0,5.7
LAUMT452594000000003,"Hilton Head Island, SC","Hilton Head Island-Bluffton-Beaufort, SC Metropolitan Statistical Area",5.0,3.6,3.4,2.5,3.3,3.4,2.3,10.8,0.1,0.4,0.2,-1.1,-0.3,93915.0,2.3
LAUMT453482000000003,"Myrtle Beach, SC","Myrtle Beach-Conway-North Myrtle Beach, SC-NC Metropolitan Statistical Area",7.5,5.2,4.3,3.3,3.8,3.7,3.0,19.9,-0.4,-0.0,-0.1,-1.3,-1.0,221102.0,5.0
LAUMT454390000000003,"Spartanburg, SC","Spartanburg, SC Metropolitan Statistical Area",6.5,4.3,3.6,2.8,3.6,3.6,2.5,13.7,0.2,0.3,0.0,-1.1,-0.0,170567.0,4.5
LAUMT454494000000003,"Sumter, SC","Sumter, SC Metropolitan Statistical Area",7.1,4.8,4.2,3.5,4.2,4.2,2.9,10.4,0.0,0.2,0.3,-1.3,-0.4,42816.0,0.1
LAUMT463966000000003,"Rapid City, SD","Rapid City, SD Metropolitan Statistical Area",4.5,2.7,2.2,2.0,2.0,1.6,1.9,11.3,-0.1,0.0,-0.1,-0.3,-1.1,81713.0,4.1
LAUMT464362000000003,"Sioux Falls, SD","Sioux Falls, SD Metropolitan Statistical Area",3.7,2.3,1.9,1.7,1.7,1.4,1.8,8.4,-0.3,-0.1,-0.1,-0.1,-0.6,166926.0,5.5
LAUMT471686000000003,"Chattanooga, TN","Chattanooga, TN-GA Metropolitan Statistical Area",6.5,4.0,3.5,3.2,3.8,3.5,3.4,13.6,0.5,0.6,0.0,-0.1,0.1,278336.0,-0.4
LAUMT471730000000003,"Clarksville, TN","Clarksville, TN-KY Metropolitan Statistical Area",7.2,4.9,4.2,3.9,4.5,4.5,4.2,16.4,0.6,0.8,0.1,0.0,0.1,119079.0,0.7
LAUMT471742000000003,"Cleveland, TN","Cleveland, TN Metropolitan Statistical Area",6.5,4.3,3.8,3.5,4.1,3.9,3.6,13.3,0.5,0.6,-0.1,-0.2,0.1,57330.0,-4.8
LAUMT472718000000003,"Jackson, TN","Jackson, TN Metropolitan Statistical Area",7.5,4.5,3.6,3.3,3.7,3.6,3.3,13.1,0.4,0.5,-0.2,-0.3,-0.2,63810.0,-2.9
LAUMT472774000000003,"Johnson City, TN","Johnson City, TN Metropolitan Statistical Area",6.4,4.0,3.7,3.4,4.0,3.7,3.4,13.2,0.5,0.6,-0.1,-0.3,-0.2,91545.0,-0.3
LAUMT472870000000003,"Bristol, VA","Kingsport-Bristol-Bristol, TN-VA Metropolitan Statistical Area",6.9,4.2,3.7,3.3,3.9,3.6,3.4,13.5,0.4,0.5,-0.2,-0.3,-0.2,137436.0,-0.4
LAUMT472870000000003,"Bristol, VA","Kingsport-Bristol-Bristol, TN-VA Metropolitan Statistical Area",6.9,4.2,3.7,3.3,3.9,3.6,3.4,13.5,0.4,0.5,-0.2,-0.3,-0.2,137436.0,-0.4
LAUMT472870000000003,"Kingsport, TN","Kingsport-Bristol-Bristol, TN-VA Metropolitan Statistical Area",6.9,4.2,3.7,3.3,3.9,3.6,3.4,13.5,0.4,0.5,-0.2,-0.3,-0.2,137436.0,-0.4
LAUMT472870000000003,"Kingsport, TN","Kingsport-Bristol-Bristol, TN-VA Metropolitan Statistical Area",6.9,4.2,3.7,3.3,3.9,3.6,3.4,13.5,0.4,0.5,-0.2,-0.3,-0.2,137436.0,-0.4
LAUMT472894000000003,"Knoxville, TN","Knoxville, TN Metropolitan Statistical Area",6.0,3.6,3.3,3.0,3.6,3.4,3.1,13.3,0.5,0.7,0.0,-0.2,-0.1,445115.0,2.2
LAUMT473282000000003,"Memphis, TN","Memphis, TN-MS-AR Metropolitan Statistical Area",10.6,6.5,4.6,3.8,4.6,4.5,4.4,12.5,0.6,0.9,-0.2,-0.2,0.3,622650.0,-4.4
LAUMT473410000000003,"Morristown, TN","Morristown, TN Metropolitan Statistical Area",6.5,4.2,3.7,3.4,4.1,3.8,3.4,16.1,0.3,0.6,-0.1,-0.3,-0.3,52876.0,-0.0
LAUMT473498000000003,"Nashville, TN","Nashville-Davidson--Murfreesboro--Franklin, TN Metropolitan Statistical Area",7.5,3.7,2.9,2.7,3.0,2.9,2.7,15.1,0.4,0.4,0.0,-0.2,0.1,1142130.0,4.0
LAUMT481018000000003,"Abilene, TX","Abilene, TX Metropolitan Statistical Area",5.6,4.4,3.5,3.5,3.8,4.0,3.9,8.4,0.2,0.5,0.4,0.4,0.9,82984.0,6.2
LAUMT481110000000003,"Amarillo, TX","Amarillo, TX Metropolitan Statistical Area",4.6,3.8,3.0,3.2,3.3,3.6,3.6,8.2,0.2,0.5,0.5,0.6,1.1,137008.0,4.5
