LAUMT481242000000003,"Austin, TX","Austin-Round Rock, TX Metropolitan Statistical Area",6.3,3.9,2.9,3.5,3.5,3.8,3.9,11.4,0.2,0.4,0.8,1.0,1.2,1453862.0,17.9
LAUMT481314000000003,"Beaumont, TX","Beaumont-Port Arthur, TX Metropolitan Statistical Area",11.5,9.2,6.1,6.3,6.4,6.7,6.7,16.8,0.3,0.5,0.5,0.6,1.2,170966.0,-0.0
LAUMT481518000000003,"Brownsville, TX","Brownsville-Harlingen, TX Metropolitan Statistical Area",10.1,7.7,5.6,5.7,5.9,6.1,6.0,15.6,0.1,0.4,0.3,0.4,0.5,182582.0,9.8
LAUMT481778000000003,"College Station, TX","College Station-Bryan, TX Metropolitan Statistical Area",5.6,4.2,3.3,3.2,3.6,3.8,3.8,8.5,0.2,0.6,0.4,0.5,1.0,145943.0,13.3
LAUMT481858000000003,"Corpus Christi, TX","Corpus Christi, TX Metropolitan Statistical Area",9.4,6.9,4.9,4.5,4.6,5.0,5.0,14.3,0.0,0.4,0.0,0.1,0.7,206009.0,0.5
LAUMT481910000000003,"Dallas, TX","Dallas-Fort Worth-Arlington, TX Metropolitan Statistical Area",7.2,4.9,3.6,3.8,3.9,4.1,4.2,12.1,0.1,0.4,0.4,0.6,0.9,4466361.0,12.8
LAUMT482134000000003,"El Paso, TX","El Paso, TX Metropolitan Statistical Area",8.1,5.9,4.3,4.5,4.5,5.1,5.2,13.8,0.1,0.5,0.8,0.9,1.4,381153.0,6.0
LAUMT482642000000003,"Houston, TX","Houston-The Woodlands-Sugar Land, TX Metropolitan Statistical Area",9.3,6.2,4.3,4.4,4.5,4.8,4.9,13.5,0.2,0.5,0.5,0.6,1.1,3634817.0,6.5
LAUMT482866000000003,"Killeen, TX","Killeen-Temple, TX Metropolitan Statistical Area",6.8,5.6,4.5,4.6,4.6,5.0,5.0,10.5,-0.0,0.3,0.4,0.5,1.2,187114.0,6.4
LAUMT482970000000003,"Laredo, TX","Laredo, TX Metropolitan Statistical Area",8.9,5.8,3.9,4.3,4.4,4.6,4.4,12.6,0.1,0.3,0.5,0.5,0.7,119462.0,1.8
LAUMT483098000000003,"Longview, TX","Longview, TX Metropolitan Statistical Area",8.3,6.0,4.3,4.3,4.5,4.7,4.8,11.4,0.2,0.5,0.3,0.5,1.1,99821.0,1.4
LAUMT483118000000003,"Lubbock, TX","Lubbock, TX Metropolitan Statistical Area",5.8,4.5,3.5,3.4,3.7,4.1,3.9,9.3,0.2,0.5,0.3,0.4,1.0,171307.0,5.5
LAUMT483258000000003,"McAllen, TX","McAllen-Edinburg-Mission, TX Metropolitan Statistical Area",12.0,8.8,6.7,6.2,6.7,7.0,6.8,16.8,0.4,0.8,0.2,0.1,0.5,383331.0,11.1
LAUMT483326000000003,"Midland, TX","Midland, TX Metropolitan Statistical Area",9.6,5.0,2.8,2.6,2.6,2.8,2.8,9.8,0.0,0.2,-0.1,0.0,0.7,115843.0,5.1
LAUMT483622000000003,"Odessa, TX","Odessa, TX Metropolitan Statistical Area",13.4,7.2,3.7,3.4,3.4,3.8,3.8,13.0,0.0,0.3,0.0,0.1,1.1,86613.0,-2.0
LAUMT484166000000003,"San Angelo, TX","San Angelo, TX Metropolitan Statistical Area",6.5,4.7,3.4,3.6,4.1,4.1,4.1,9.5,0.3,0.6,0.6,0.7,1.1,57386.0,5.2
LAUMT484170000000003,"San Antonio, TX","San Antonio-New Braunfels, TX Metropolitan Statistical Area",7.5,5.0,3.7,3.8,3.8,4.2,4.3,12.6,0.1,0.4,0.4,0.6,1.2,1289819.0,7.6
LAUMT484330000000003,"Sherman, TX","Sherman-Denison, TX Metropolitan Statistical Area",5.7,4.5,3.8,3.9,4.0,4.3,4.3,9.8,0.1,0.4,0.5,0.5,1.2,67972.0,5.5
LAUMT484550000000003,"Texarkana, TX","Texarkana, TX-AR Metropolitan Statistical Area",7.0,5.3,4.5,3.8,4.0,4.3,4.2,13.0,0.0,0.4,-0.3,-0.3,-0.1,63430.0,-1.6
LAUMT484634000000003,"Tyler, TX","Tyler, TX Metropolitan Statistical Area",6.7,5.0,3.8,3.8,3.8,4.3,4.3,11.3,0.1,0.5,0.5,0.5,1.0,114014.0,5.7
LAUMT484702000000003,"Victoria, TX","Victoria, TX Metropolitan Statistical Area",8.6,6.0,4.2,4.1,4.3,4.5,4.5,13.3,0.1,0.4,0.2,0.3,1.0,45433.0,0.0
LAUMT484738000000003,"Waco, TX","Waco, TX Metropolitan Statistical Area",6.1,4.8,3.6,3.7,4.0,4.2,4.1,9.8,-0.0,0.4,0.3,0.5,0.8,138404.0,9.9
LAUMT484866000000003,"Wichita Falls, TX","Wichita Falls, TX Metropolitan Statistical Area",6.6,5.0,4.0,3.9,4.1,4.5,4.4,10.2,0.1,0.5,0.4,0.4,1.3,65095.0,0.4
LAUMT493086000000003,"Logan, UT","Logan, UT-ID Metropolitan Statistical Area",3.1,2.3,2.3,2.1,2.4,2.3,2.7,5.8,0.2,0.4,0.3,0.4,0.6,77846.0,12.6
LAUMT493626000000003,"Ogden, UT","Ogden-Clearfield, UT Metropolitan Statistical Area",4.3,2.7,2.5,2.4,2.6,2.6,2.9,9.4,0.2,0.4,0.4,0.4,0.3,369685.0,9.0
LAUMT493934000000003,"Provo, UT","Provo-Orem, UT Metropolitan Statistical Area",3.9,2.5,2.4,2.4,2.8,2.7,3.0,7.4,0.3,0.5,0.5,0.6,0.7,361749.0,15.3
LAUMT494110000000003,"St. George, UT","St. George, UT Metropolitan Statistical Area",5.5,3.0,2.9,2.6,3.0,3.0,3.2,11.7,0.3,0.6,0.4,0.3,0.3,90560.0,18.4
LAUMT494162000000003,"Salt Lake City, UT","Salt Lake City, UT Metropolitan Statistical Area",5.4,2.8,2.5,2.5,2.7,2.7,3.0,10.6,0.2,0.4,0.3,0.5,0.5,750290.0,10.6
LAUMT507240000000003,"Burlington, VT","Burlington-South Burlington, VT Metropolitan NECTA",4.6,3.0,2.3,1.3,1.8,1.5,1.8,11.5,-0.2,0.2,-0.7,-0.5,0.1,130250.0,-0.8
LAUMT511398000000003,"Blacksburg, VA","Blacksburg-Christiansburg-Radford, VA Metropolitan Statistical Area",6.6,3.6,3.5,2.9,3.1,2.9,3.4,11.6,0.3,0.5,-0.3,-0.1,0.4,95465.0,6.0
LAUMT511682000000003,"Charlottesville, VA","Charlottesville, VA Metropolitan Statistical Area",7.0,3.6,3.2,2.5,2.7,2.5,2.9,10.2,0.1,0.3,-0.5,-0.3,0.4,126874.0,2.9
LAUMT512550000000003,"Harrisonburg, VA","Harrisonburg, VA Metropolitan Statistical Area",5.8,3.6,3.6,2.9,3.1,2.8,3.3,10.7,0.3,0.4,-0.5,-0.3,0.6,70142.0,5.0
LAUMT513134000000003,"Lynchburg, VA","Lynchburg, VA Metropolitan Statistical Area",7.0,4.2,4.0,3.2,3.5,3.2,3.7,10.5,0.1,0.4,-0.3,-0.3,0.5,126583.0,1.8
LAUMT514006000000003,"Richmond, VA","Richmond, VA Metropolitan Statistical Area",8.3,4.3,3.5,2.8,3.0,2.8,3.2,11.5,-0.0,0.2,-0.3,-0.3,0.3,734739.0,5.2
LAUMT514022000000003,"Roanoke, VA","Roanoke, VA Metropolitan Statistical Area",7.1,3.9,3.3,2.7,2.9,2.7,3.1,10.8,0.1,0.3,-0.3,-0.2,0.3,164510.0,2.9
LAUMT514442000000003,"Staunton, VA","Staunton-Waynesboro, VA Metropolitan Statistical Area",6.2,3.5,3.3,2.6,2.7,2.5,2.7,9.9,0.1,0.1,-0.4,-0.6,0.1,63542.0,4.3
LAUMT514726000000003,"Virginia Beach, VA","Virginia Beach-Norfolk-Newport News, VA-NC Metropolitan Statistical Area",8.9,4.6,3.7,2.9,3.0,2.9,3.3,12.4,-0.1,0.2,-0.4,-0.4,0.2,883875.0,0.8
LAUMT514902000000003,"Winchester, VA","Winchester, VA-WV Metropolitan Statistical Area",5.4,3.1,2.9,2.5,2.6,2.5,2.8,10.0,0.1,0.2,-0.2,-0.1,0.1,80312.0,6.8
LAUMT531338000000003,"Bellingham, WA","Bellingham, WA Metropolitan Statistical Area",9.1,6.1,5.3,3.1,3.1,3.4,4.2,17.9,-1.7,-0.3,-1.0,-1.1,-0.8,112750.0,-3.0
LAUMT531474000000003,"Bremerton, WA","Bremerton-Silverdale, WA Metropolitan Statistical Area",7.4,5.2,4.9,3.0,2.9,3.2,3.9,14.5,-1.7,-0.4,-0.9,-1.0,-0.7,130053.0,0.8
LAUMT532842000000003,"Kennewick, WA","Kennewick-Richland, WA Metropolitan Statistical Area",8.1,5.9,5.4,3.5,3.5,3.6,4.4,13.6,-2.3,-0.7,-0.9,-1.0,-1.3,153325.0,1.2
LAUMT533102000000003,"Longview, WA","Longview, WA Metropolitan Statistical Area",8.9,6.6,6.0,3.7,3.6,4.0,4.8,15.9,-2.1,-0.5,-1.1,-1.2,-1.2,49127.0,2.3
LAUMT533458000000003,"Mount Vernon, WA","Mount Vernon-Anacortes, WA Metropolitan Statistical Area",9.0,6.2,5.4,3.3,3.3,3.5,4.2,19.0,-1.9,-0.5,-1.1,-1.2,-1.3,62689.0,-2.7
LAUMT533650000000003,"Olympia, WA","Olympia-Tumwater, WA Metropolitan Statistical Area",7.8,5.3,5.0,3.0,2.9,3.2,3.9,16.0,-1.7,-0.5,-1.0,-1.1,-1.0,149781.0,5.6
LAUMT534266000000003,"Seattle, WA","Seattle-Tacoma-Bellevue, WA Metropolitan Statistical Area",8.5,4.5,3.8,3.2,3.3,3.6,3.8,16.5,0.2,0.4,0.0,0.0,0.5,2282960.0,5.0
LAUMT534406000000003,"Spokane, WA","Spokane-Spokane Valley, WA Metropolitan Statistical Area",8.5,5.5,5.1,3.0,3.0,3.3,4.0,16.0,-2.2,-0.6,-1.0,-1.1,-1.5,287767.0,3.7
LAUMT534746000000003,"Walla Walla, WA","Walla Walla, WA Metropolitan Statistical Area",6.3,4.8,4.8,2.9,3.1,3.2,3.8,12.1,-1.7,-0.3,-0.9,-1.0,-1.2,32834.0,0.4
LAUMT534830000000003,"Wenatchee, WA","Wenatchee, WA Metropolitan Statistical Area",7.3,5.1,5.1,3.2,2.8,2.9,3.9,15.7,-2.6,-1.0,-0.6,-1.2,-1.3,68863.0,-11.4
LAUMT534942000000003,"Yakima, WA","Yakima, WA Metropolitan Statistical Area",9.2,6.6,6.2,4.2,3.7,3.7,4.7,14.4,-3.4,-1.5,-1.1,-1.5,-2.4,138949.0,-1.5
LAUMT541322000000003,"Beckley, WV","Beckley, WV Metropolitan Statistical Area",8.7,5.2,4.3,3.4,3.9,3.7,4.2,18.4,0.0,0.4,-0.4,-0.1,-0.9,47839.0,0.9
LAUMT541662000000003,"Charleston, WV","Charleston, WV Metropolitan Statistical Area",9.2,5.2,4.2,3.3,3.8,3.7,4.3,17.3,0.1,0.5,-0.3,0.1,-0.5,91715.0,-3.1
LAUMT542658000000003,"Huntington, WV","Huntington-Ashland, WV-KY-OH Metropolitan Statistical Area",7.6,5.0,4.5,3.8,4.5,4.3,4.6,16.4,0.2,0.6,-0.3,0.1,-0.4,149060.0,1.1
LAUMT543406000000003,"Morgantown, WV","Morgantown, WV Metropolitan Statistical Area",6.2,4.4,4.0,2.9,3.5,3.3,3.6,12.7,0.3,0.6,-0.6,-0.4,-0.3,71860.0,3.3
LAUMT543762000000003,"Parkersburg, WV","Parkersburg-Vienna, WV Metropolitan Statistical Area",8.1,5.1,4.4,3.6,4.0,3.8,4.5,17.1,-0.2,0.3,-0.3,0.1,-0.8,39487.0,0.2
LAUMT544854000000003,"Wheeling, WV","Wheeling, WV-OH Metropolitan Statistical Area",9.0,5.6,4.8,3.8,4.3,4.0,4.6,16.7,-0.7,0.1,-0.7,-0.2,-0.9,59698.0,-11.1
LAUMT551154000000003,"Appleton, WI","Appleton, WI Metropolitan Statistical Area",5.0,3.1,2.8,2.2,3.1,2.8,3.3,13.2,0.8,1.1,0.0,0.5,0.5,135938.0,1.7
LAUMT552074000000003,"Eau Claire, WI","Eau Claire, WI Metropolitan Statistical Area",5.6,3.3,2.9,2.4,3.3,3.0,3.6,12.7,0.2,0.8,0.1,0.7,0.5,95478.0,3.0
LAUMT552254000000003,"Fond du Lac, WI","Fond du Lac, WI Metropolitan Statistical Area",4.8,3.3,3.0,2.2,3.2,2.9,3.3,16.4,0.7,1.1,0.0,0.3,0.5,58229.0,-0.3
LAUMT552458000000003,"Green Bay, WI","Green Bay, WI Metropolitan Statistical Area",5.6,3.4,2.9,2.4,3.1,2.9,3.4,13.4,0.6,0.9,0.1,0.5,0.4,177916.0,1.3
LAUMT552750000000003,"Janesville, WI","Janesville-Beloit, WI Metropolitan Statistical Area",6.6,4.2,3.8,3.3,3.9,3.6,4.1,16.4,0.7,0.9,0.0,0.3,0.6,88207.0,0.8
LAUMT552910000000003,"La Crosse, WI","La Crosse-Onalaska, WI-MN Metropolitan Statistical Area",5.0,2.9,2.5,2.2,3.1,2.7,3.2,11.9,0.5,1.0,0.1,0.7,0.4,78625.0,2.8
LAUMT553154000000003,"Madison, WI","Madison, WI Metropolitan Statistical Area",4.9,2.9,2.4,2.1,2.8,2.5,3.0,11.1,0.7,1.0,0.1,0.6,0.6,405543.0,2.1
LAUMT553334000000003,"Milwaukee, WI","Milwaukee-Waukesha-West Allis, WI Metropolitan Statistical Area",7.5,4.5,3.6,3.1,3.8,3.6,4.1,14.3,1.0,1.2,0.0,0.5,0.8,834753.0,0.3
LAUMT553678000000003,"Oshkosh, WI","Oshkosh-Neenah, WI Metropolitan Statistical Area",5.0,3.4,2.9,2.4,3.2,2.9,3.5,13.6,0.9,1.2,0.0,0.6,0.6,94861.0,2.0
LAUMT553954000000003,"Racine, WI","Racine, WI Metropolitan Statistical Area",7.1,4.7,4.0,3.2,3.9,3.8,4.4,15.3,0.7,1.1,-0.1,0.4,0.5,102606.0,1.7
LAUMT554310000000003,"Sheboygan, WI","Sheboygan, WI Metropolitan Statistical Area",5.0,3.1,2.6,2.3,3.0,2.6,3.1,14.3,0.8,1.0,0.0,0.5,0.5,63611.0,-1.2
LAUMT554814000000003,"Wausau, WI","Wausau, WI Metropolitan Statistical Area",4.5,3.1,2.9,2.4,3.2,3.0,3.4,11.6,0.7,1.0,0.2,0.5,0.7,73966.0,-1.0
LAUMT561622000000003,"Casper, WY","Casper, WY Metropolitan Statistical Area",8.4,5.4,3.9,2.9,3.2,3.1,3.0,6.7,-1.1,-0.6,-0.6,-0.9,-1.0,40323.0,0.8
LAUMT561694000000003,"Cheyenne, WY","Cheyenne, WY Metropolitan Statistical Area",4.5,3.7,3.5,2.8,3.0,2.8,2.8,4.8,-0.8,-0.4,-0.6,-0.7,-0.7,50008.0,1.2
