LAUMT481242000000003,"Austin, TX","Austin-Round Rock, TX Metropolitan Statistical Area",5.1,3.5,2.8,3.8,3.9,3.6,3.3,11.4,0.4,0.0,0.8,0.5,0.6,1460023.0,18.1
LAUMT481314000000003,"Beaumont, TX","Beaumont-Port Arthur, TX Metropolitan Statistical Area",10.0,7.5,5.3,6.7,6.7,5.8,5.2,16.8,0.3,-0.6,0.3,-0.1,-0.3,169230.0,-1.5
LAUMT481518000000003,"Brownsville, TX","Brownsville-Harlingen, TX Metropolitan Statistical Area",8.9,6.6,5.1,6.1,5.9,5.3,4.9,15.6,0.2,-0.5,0.1,-0.2,-0.6,181439.0,9.9
LAUMT481778000000003,"College Station, TX","College Station-Bryan, TX Metropolitan Statistical Area",4.6,3.6,3.0,3.8,3.8,3.2,3.0,8.5,0.4,-0.2,0.2,0.0,0.2,152925.0,13.4
LAUMT481858000000003,"Corpus Christi, TX","Corpus Christi, TX Metropolitan Statistical Area",8.1,5.9,4.5,5.0,5.0,4.5,4.2,14.3,0.4,-0.1,-0.1,-0.3,-0.1,205251.0,0.9
LAUMT481910000000003,"Dallas, TX","Dallas-Fort Worth-Arlington, TX Metropolitan Statistical Area",6.0,4.3,3.4,4.1,4.2,3.9,3.6,12.1,0.4,-0.0,0.5,0.2,0.3,4472710.0,12.8
LAUMT482134000000003,"El Paso, TX","El Paso, TX Metropolitan Statistical Area",7.1,5.2,4.1,5.1,5.2,4.7,4.4,13.8,0.6,0.1,0.6,0.3,0.6,379660.0,4.3
LAUMT482642000000003,"Houston, TX","Houston-The Woodlands-Sugar Land, TX Metropolitan Statistical Area",7.7,5.2,3.9,4.8,4.9,4.4,4.1,13.5,0.4,-0.1,0.4,0.2,0.3,3625171.0,6.3
LAUMT482866000000003,"Killeen, TX","Killeen-Temple, TX Metropolitan Statistical Area",6.0,5.2,4.3,5.0,5.0,4.5,4.3,10.5,0.4,-0.1,0.3,0.0,0.5,187539.0,6.6
LAUMT482970000000003,"Laredo, TX","Laredo, TX Metropolitan Statistical Area",7.7,5.2,3.7,4.6,4.4,4.0,3.7,12.6,0.2,-0.4,0.4,0.0,-0.0,119713.0,1.7
LAUMT483098000000003,"Longview, TX","Longview, TX Metropolitan Statistical Area",7.5,5.3,4.0,4.7,4.8,4.4,4.1,11.4,0.4,-0.1,0.4,0.1,0.4,98923.0,0.4
LAUMT483118000000003,"Lubbock, TX","Lubbock, TX Metropolitan Statistical Area",5.0,3.9,3.3,4.1,3.9,3.3,3.2,9.3,0.4,-0.3,0.1,-0.1,0.3,171864.0,6.0
LAUMT483258000000003,"McAllen, TX","McAllen-Edinburg-Mission, TX Metropolitan Statistical Area",10.2,7.2,5.6,7.0,6.8,5.8,5.2,16.8,0.4,-0.7,-0.2,-0.4,-1.1,380965.0,9.2
LAUMT483326000000003,"Midland, TX","Midland, TX Metropolitan Statistical Area",8.5,4.3,2.6,2.8,2.8,2.5,2.4,9.8,0.2,-0.1,-0.1,-0.2,0.3,115562.0,5.7
LAUMT483622000000003,"Odessa, TX","Odessa, TX Metropolitan Statistical Area",12.0,5.9,3.4,3.8,3.8,3.4,3.2,13.0,0.4,-0.1,0.0,-0.2,0.5,87294.0,-1.0
LAUMT484166000000003,"San Angelo, TX","San Angelo, TX Metropolitan Statistical Area",5.6,4.3,3.3,4.1,4.0,3.6,3.4,9.5,0.3,-0.3,0.4,0.1,0.4,57248.0,3.8
LAUMT484170000000003,"San Antonio, TX","San Antonio-New Braunfels, TX Metropolitan Statistical Area",6.3,4.4,3.5,4.2,4.3,3.8,3.6,12.6,0.4,-0.0,0.3,0.1,0.5,1296775.0,8.2
LAUMT484330000000003,"Sherman, TX","Sherman-Denison, TX Metropolitan Statistical Area",5.0,4.3,3.6,4.3,4.3,3.9,3.7,9.8,0.4,-0.1,0.3,0.1,0.6,67661.0,5.9
LAUMT484550000000003,"Texarkana, TX","Texarkana, TX-AR Metropolitan Statistical Area",5.7,4.5,4.0,4.3,4.2,3.9,3.5,13.0,0.3,-0.2,-0.3,-0.5,-0.8,63086.0,-2.1
LAUMT484634000000003,"Tyler, TX","Tyler, TX Metropolitan Statistical Area",5.9,4.5,3.6,4.3,4.2,3.9,3.6,11.3,0.5,-0.1,0.3,0.0,0.3,113817.0,5.8
LAUMT484702000000003,"Victoria, TX","Victoria, TX Metropolitan Statistical Area",7.5,5.4,4.0,4.5,4.5,4.1,3.9,13.3,0.3,-0.1,0.2,-0.1,0.4,45051.0,-0.5
LAUMT484738000000003,"Waco, TX","Waco, TX Metropolitan Statistical Area",5.4,4.2,3.4,4.2,4.1,3.7,3.5,9.8,0.3,-0.2,0.3,0.1,0.2,137335.0,9.8
LAUMT484866000000003,"Wichita Falls, TX","Wichita Falls, TX Metropolitan Statistical Area",6.0,4.5,3.7,4.5,4.4,4.0,3.7,10.2,0.5,-0.1,0.4,0.0,0.6,64955.0,0.7
LAUMT493086000000003,"Logan, UT","Logan, UT-ID Metropolitan Statistical Area",2.3,1.7,1.9,2.3,2.7,2.2,2.3,5.8,0.3,0.1,0.4,0.4,0.2,81323.0,11.1
LAUMT493626000000003,"Ogden, UT","Ogden-Clearfield, UT Metropolitan Statistical Area",3.4,2.0,2.2,2.6,2.9,2.5,2.6,9.4,0.3,0.1,0.4,0.4,0.0,368755.0,9.9
LAUMT493934000000003,"Provo, UT","Provo-Orem, UT Metropolitan Statistical Area",3.0,1.8,2.1,2.7,3.0,2.6,2.7,7.4,0.3,0.1,0.6,0.6,0.4,362128.0,13.4
LAUMT494110000000003,"St. George, UT","St. George, UT Metropolitan Statistical Area",4.0,2.2,2.3,3.0,3.2,2.7,2.8,11.7,0.3,0.0,0.4,0.5,-0.1,91315.0,17.6
LAUMT494162000000003,"Salt Lake City, UT","Salt Lake City, UT Metropolitan Statistical Area",4.0,2.1,2.2,2.7,3.0,2.6,2.7,10.6,0.3,0.1,0.5,0.5,0.2,746282.0,10.5
LAUMT507240000000003,"Burlington, VT","Burlington-South Burlington, VT Metropolitan NECTA",2.8,2.0,2.0,1.5,1.8,1.8,1.6,11.5,0.2,0.2,-0.6,-0.4,-0.1,131362.0,0.7
LAUMT511398000000003,"Blacksburg, VA","Blacksburg-Christiansburg-Radford, VA Metropolitan Statistical Area",3.9,2.8,3.0,2.9,3.4,3.0,3.0,11.6,0.3,0.2,0.1,0.0,0.0,98142.0,5.7
LAUMT511682000000003,"Charlottesville, VA","Charlottesville, VA Metropolitan Statistical Area",4.6,2.8,2.7,2.5,2.9,2.6,2.6,10.2,0.2,0.1,-0.1,-0.1,0.1,130324.0,4.2
LAUMT512550000000003,"Harrisonburg, VA","Harrisonburg, VA Metropolitan Statistical Area",3.8,2.9,3.0,2.8,3.3,2.8,2.8,10.7,0.2,0.0,-0.2,-0.2,0.1,73080.0,7.4
LAUMT513134000000003,"Lynchburg, VA","Lynchburg, VA Metropolitan Statistical Area",4.9,3.4,3.4,3.2,3.8,3.5,3.5,10.5,0.3,0.3,0.1,0.1,0.3,126139.0,1.9
LAUMT514006000000003,"Richmond, VA","Richmond, VA Metropolitan Statistical Area",5.9,3.4,3.1,2.8,3.3,3.2,3.1,11.5,0.3,0.3,0.0,0.0,0.2,732537.0,6.7
LAUMT514022000000003,"Roanoke, VA","Roanoke, VA Metropolitan Statistical Area",4.9,3.4,2.9,2.7,3.1,3.0,2.9,10.8,0.3,0.2,0.0,0.0,0.1,164667.0,4.2
LAUMT514442000000003,"Staunton, VA","Staunton-Waynesboro, VA Metropolitan Statistical Area",4.2,2.7,2.7,2.5,2.7,2.7,2.7,9.9,0.1,0.1,-0.1,0.0,0.1,64206.0,5.9
LAUMT514726000000003,"Virginia Beach, VA","Virginia Beach-Norfolk-Newport News, VA-NC Metropolitan Statistical Area",6.1,3.7,3.3,2.9,3.3,3.4,3.3,12.4,0.3,0.4,0.1,0.0,0.2,878871.0,2.4
LAUMT514902000000003,"Winchester, VA","Winchester, VA-WV Metropolitan Statistical Area",3.7,2.6,2.6,2.5,2.8,2.7,2.6,10.0,0.2,0.2,0.2,0.0,-0.1,81454.0,9.6
LAUMT531338000000003,"Bellingham, WA","Bellingham, WA Metropolitan Statistical Area",7.1,4.7,4.7,3.4,4.2,3.6,4.1,17.9,0.4,0.8,-0.9,-0.6,-1.0,115867.0,0.7
LAUMT531474000000003,"Bremerton, WA","Bremerton-Silverdale, WA Metropolitan Statistical Area",5.9,4.2,4.5,3.2,3.9,3.5,4.0,14.5,0.3,0.8,-0.7,-0.5,-0.6,132076.0,2.3
LAUMT532842000000003,"Kennewick, WA","Kennewick-Richland, WA Metropolitan Statistical Area",5.8,4.6,4.8,3.6,4.3,3.7,4.1,13.6,0.1,0.5,-0.9,-0.7,-1.6,153246.0,2.8
LAUMT533102000000003,"Longview, WA","Longview, WA Metropolitan Statistical Area",7.2,5.1,5.6,4.0,4.8,4.1,4.6,15.9,0.3,0.7,-1.3,-1.0,-1.5,49886.0,3.7
LAUMT533458000000003,"Mount Vernon, WA","Mount Vernon-Anacortes, WA Metropolitan Statistical Area",7.0,5.0,4.9,3.5,4.2,3.8,4.3,19.0,0.3,0.7,-0.8,-0.6,-1.2,62563.0,-2.1
LAUMT533650000000003,"Olympia, WA","Olympia-Tumwater, WA Metropolitan Statistical Area",6.0,4.3,4.5,3.2,3.9,3.4,3.8,16.0,0.3,0.7,-0.9,-0.7,-1.1,153747.0,6.8
LAUMT534266000000003,"Seattle, WA","Seattle-Tacoma-Bellevue, WA Metropolitan Statistical Area",6.7,3.7,3.7,3.6,3.8,3.7,3.9,16.5,0.5,0.4,0.1,0.2,0.6,2259848.0,3.4
LAUMT534406000000003,"Spokane, WA","Spokane-Spokane Valley, WA Metropolitan Statistical Area",6.1,4.3,4.6,3.3,4.0,3.4,3.8,16.0,0.2,0.6,-1.0,-0.8,-1.7,294828.0,5.1
LAUMT534746000000003,"Walla Walla, WA","Walla Walla, WA Metropolitan Statistical Area",4.8,3.8,4.1,3.2,3.8,3.1,3.6,12.1,0.2,0.4,-1.0,-0.5,-1.4,33238.0,1.6
LAUMT534830000000003,"Wenatchee, WA","Wenatchee, WA Metropolitan Statistical Area",5.5,4.1,4.2,2.9,3.9,3.2,3.7,15.7,0.0,0.6,-0.7,-0.5,-1.5,65641.0,-6.0
LAUMT534942000000003,"Yakima, WA","Yakima, WA Metropolitan Statistical Area",6.4,4.8,5.3,3.7,4.6,3.8,4.5,14.4,-0.4,0.4,-1.0,-0.8,-2.6,127769.0,-9.0
LAUMT541322000000003,"Beckley, WV","Beckley, WV Metropolitan Statistical Area",6.7,3.9,3.5,3.7,4.2,3.7,3.7,18.4,0.3,0.2,0.4,0.2,-1.4,46992.0,-0.1
LAUMT541662000000003,"Charleston, WV","Charleston, WV Metropolitan Statistical Area",6.9,3.8,3.4,3.7,4.3,3.9,3.8,17.3,0.5,0.4,0.6,0.4,-1.0,90352.0,-3.0
LAUMT542658000000003,"Huntington, WV","Huntington-Ashland, WV-KY-OH Metropolitan Statistical Area",5.6,4.0,3.7,4.3,4.6,4.1,3.9,16.4,0.3,0.0,0.5,0.2,-1.1,147288.0,0.0
LAUMT543406000000003,"Morgantown, WV","Morgantown, WV Metropolitan Statistical Area",4.5,3.3,3.0,3.3,3.6,3.2,3.1,12.7,0.3,0.1,0.3,0.1,-0.8,72141.0,1.0
LAUMT543762000000003,"Parkersburg, WV","Parkersburg-Vienna, WV Metropolitan Statistical Area",6.4,3.7,3.6,3.8,4.4,3.9,3.9,17.1,0.3,0.3,0.5,0.3,-1.4,39004.0,-0.4
LAUMT544854000000003,"Wheeling, WV","Wheeling, WV-OH Metropolitan Statistical Area",6.5,4.1,4.1,4.0,4.6,4.1,4.0,16.7,0.2,0.2,0.0,-0.1,-1.5,59167.0,-10.0
LAUMT551154000000003,"Appleton, WI","Appleton, WI Metropolitan Statistical Area",3.6,2.3,2.1,2.8,3.3,2.8,2.6,13.2,0.6,0.2,0.4,0.5,-0.2,134849.0,3.4
LAUMT552074000000003,"Eau Claire, WI","Eau Claire, WI Metropolitan Statistical Area",3.7,2.3,2.3,3.0,3.6,3.0,2.8,12.7,0.5,0.2,0.5,0.5,-0.4,95353.0,3.5
LAUMT552254000000003,"Fond du Lac, WI","Fond du Lac, WI Metropolitan Statistical Area",3.6,2.3,2.3,2.9,3.3,2.8,2.6,16.4,0.6,0.1,0.3,0.3,-0.2,57382.0,0.0
LAUMT552458000000003,"Green Bay, WI","Green Bay, WI Metropolitan Statistical Area",4.2,2.5,2.4,2.9,3.4,3.0,2.7,13.4,0.6,0.2,0.4,0.3,-0.3,177273.0,2.0
LAUMT552750000000003,"Janesville, WI","Janesville-Beloit, WI Metropolitan Statistical Area",4.9,3.5,3.1,3.6,4.1,3.6,3.4,16.4,0.5,0.1,0.4,0.3,-0.1,87596.0,2.2
LAUMT552910000000003,"La Crosse, WI","La Crosse-Onalaska, WI-MN Metropolitan Statistical Area",3.4,2.2,2.1,2.7,3.2,2.8,2.5,11.9,0.5,0.2,0.5,0.4,-0.3,79916.0,4.4
LAUMT553154000000003,"Madison, WI","Madison, WI Metropolitan Statistical Area",3.7,2.2,2.1,2.5,3.0,2.7,2.5,11.1,0.6,0.3,0.4,0.4,0.1,411447.0,5.3
LAUMT553334000000003,"Milwaukee, WI","Milwaukee-Waukesha-West Allis, WI Metropolitan Statistical Area",5.8,3.3,3.0,3.6,4.2,3.7,3.4,14.3,0.7,0.3,0.6,0.4,0.1,825426.0,0.5
LAUMT553678000000003,"Oshkosh, WI","Oshkosh-Neenah, WI Metropolitan Statistical Area",3.7,2.4,2.3,2.9,3.5,3.0,2.8,13.6,0.7,0.3,0.5,0.5,-0.1,94940.0,3.9
LAUMT553954000000003,"Racine, WI","Racine, WI Metropolitan Statistical Area",5.7,3.4,3.1,3.8,4.4,3.7,3.4,15.3,0.7,0.2,0.5,0.3,-0.5,100779.0,2.3
LAUMT554310000000003,"Sheboygan, WI","Sheboygan, WI Metropolitan Statistical Area",3.7,2.3,2.3,2.6,3.1,2.8,2.6,14.3,0.5,0.2,0.3,0.3,-0.0,62641.0,0.3
LAUMT554814000000003,"Wausau, WI","Wausau, WI Metropolitan Statistical Area",3.4,2.2,2.2,3.0,3.4,3.0,2.7,11.6,0.6,0.2,0.5,0.5,-0.0,73295.0,0.0
LAUMT561622000000003,"Casper, WY","Casper, WY Metropolitan Statistical Area",7.0,4.4,3.7,3.1,3.0,2.8,2.8,6.7,-0.3,-0.2,-0.8,-0.9,-1.2,39967.0,1.2
LAUMT561694000000003,"Cheyenne, WY","Cheyenne, WY Metropolitan Statistical Area",4.0,3.3,3.5,2.8,2.8,2.6,2.7,4.8,-0.3,-0.2,-0.7,-0.8,-0.8,49549.0,2.1
